"","titulo","link","desc","data","categoria_principal"
"141","Veja o que È #FATO ou #FAKE na entrevista de Luiz Marinho ao SP1","www.valor.com.br/fatooufake/5839457/veja-o-que-e-fato-ou-fake-na-entrevista-de-luiz-marinho-ao-sp1","Candidato do PT ao governo S„o Paulo foi o quarto entre os cinco candidatos na sÈrie de entrevistas ao SP1 ao longo desta semana","13/09/2018 ‡s 20h54","entrevista, fake, fato, candidato"
"142","Todos esperavam uma salvaÁ„o, diz ex-Lehman","www.valor.com.br/financas/5839367/todos-esperavam-uma-salvacao-diz-ex-lehman","Executivo sÛ percebeu gravidade da situaÁ„o quando foi aconselhado a levar para casa objetos pessoais","13/09/2018 ‡s 20h37","diz, esperavam, exlehman, salvacao, todo, aconselhado, casa, executivo, gravidad, levar, objeto, percebeu, pessoai, situacao, financeira, instituico"
"143","PÛs-crise eleva seguranÁa, mas encarece competiÁ„o banc·ria","www.valor.com.br/financas/5839353/pos-crise-eleva-seguranca-mas-encarece-competicao-bancaria","Resposta ‡ quebra do Lehman Brothers exigiu mais capital das instituiÁıes financeiras","13/09/2018 ‡s 20h35","bancaria, competicao, eleva, encarec, poscris, seguranca, brother, capit, exigiu, financeira, instituico, lehman, quebra, resposta, mercado"
"144","Tilray: AÁ„o bate recorde com acordo para exportar maconha a Alemanha","www.valor.com.br/empresas/5838731/tilray-acao-bate-recorde-com-acordo-para-exportar-maconha-alemanha","Os papÈis subiram 21%, a US$ 127,27, o que levou o valor de mercado do produtor de maconha para mais de US$ 11 bilhıes","13/09/2018 ‡s 18h39","maconha"
"145","Nervosismo eleitoral faz Ibovespa devolver ganhos de sess„o anterior","www.valor.com.br/financas/5838559/nervosismo-eleitoral-faz-ibovespa-devolver-ganhos-de-sessao-anterior","Indicador encerrou o dia em queda de 0,58%, aos 74.687 pontos, apÛs oscilar entre os 74.501 pontos e os 75.407 pontos","13/09/2018 ‡s 18h07","ponto"
"146","Bolsas de NY fecham em alta, com retomada do setor de tecnologia","www.valor.com.br/financas/5838557/bolsas-de-ny-fecham-em-alta-com-retomada-do-setor-de-tecnologia","Destaque para as aÁıes de tecnologia, com as aÁıes da Apple em alta de 2,42%, a US$ 226,41, apÛs perda de 1,24% na quarta","13/09/2018 ‡s 18h07","alta, tecnologia, aco"
"147","Peso cai apÛs assessor de Trump falar em dolarizaÁ„o na Argentina","www.valor.com.br/internacional/5838507/peso-cai-apos-assessor-de-trump-falar-em-dolarizacao-na-argentina","O dÛlar fechou a 40,22 pesos, alta de 2,92%, segundo a taxa mÈdia do Banco Central. Esta foi a quarta alta seguida da moeda americana","13/09/2018 ‡s 17h53","peso, alta"
"148","PetrÛleo fecha em baixa, com aumento da produÁ„o da Opep","www.valor.com.br/financas/5838489/petroleo-fecha-em-baixa-com-aumento-da-producao-da-opep","RelatÛrio mensal da AgÍncia Internacional de Energia (AIE) mostrou que a produÁ„o da Opep aumentou o correspondente a 420 mil barris/dia","13/09/2018 ‡s 17h48","opep, producao"
"149","Juros futuros fecham perto das m·ximas com temor de avanÁo de Haddad","www.valor.com.br/financas/5838269/juros-futuros-fecham-perto-das-maximas-com-temor-de-avanco-de-haddad","Os contratos de juros futuros aceleraram o movimento de alta e fecharam o preg„o regular perto das m·ximas do dia","13/09/2018 ‡s 17h00","futuro, juro, maxima, perto"
"150","Ibovespa cai com incerteza eleitoral, mas mantÈm os 74 mil pontos","www.valor.com.br/financas/5838243/ibovespa-cai-com-incerteza-eleitoral-mas-mantem-os-74-mil-pontos",NA,"13/09/2018 ‡s 16h54","cai, eleitor, ibovespa, incerteza, mantem, mil, ponto, mercado"
