"","titulo","link","desc","data","categoria_principal"
"1","Ibovespa volta a subir e dÛlar registra queda","www.valor.com.br/financas/5861443/ibovespa-volta-subir-e-dolar-registra-queda","Embora Haddad cresÁa nas pesquisas, Bolsonaro permanece forte para enfrentar o segundo turno; ambiente no exterior favorece commodities","19/09/2018 ‡s 14h07","dolar, ibovespa, queda, registra, subir, volta, ambient, bolsonaro, commod, cresca, embora, enfrentar, exterior, favorec, fort, haddad, permanec, pesquisa, segundo, turno, mercado"
"2","Bolsas da Europa fecham em alta moderada, com commodities","www.valor.com.br/financas/5861381/bolsas-da-europa-fecham-em-alta-moderada-com-commodities","O setor de matÈrias-primas liderou os ganhos nesta quarta-feira entre os componentes do Ìndice pan-europeu Stoxx 600","19/09/2018 ‡s 13h48","alta, bolsa, commod, europa, fecham, moderada, component, ganho, indic, liderou, materiasprima, nesta, paneuropeu, quartafeira, setor, stoxx, mercado"
"3","An·lise: Como os BCs de emergentes asi·ticos reagem ‡ guerra comercial","www.valor.com.br/financas/5861285/analise-como-os-bcs-de-emergentes-asiaticos-reagem-guerra-comercial",NA,"19/09/2018 ‡s 13h24","analis, asiatico, bcs, comerci, emergent, guerra, reagem, monetaria, politica"
"4","BC tem perda de R$ 981 milhıes com swap em setembro atÈ o dia 14","www.valor.com.br/financas/5861265/bc-tem-perda-de-r-981-milhoes-com-swap-em-setembro-ate-o-dia-14","⁄ltima vez em que a autoridade monet·ria ofereceu novos contratos do derivativo foi em 30 de agosto","19/09/2018 ‡s 13h17","ate, dia, milho, perda, setembro, swap, agosto, autoridad, contrato, derivativo, monetaria, novo, ofereceu, ultima, vez, mercado"
"5","Fluxo cambial fica negativo em US$ 619 milhıes na semana","www.valor.com.br/financas/5861241/fluxo-cambial-fica-negativo-em-us-619-milhoes-na-semana","No acumulado de setembro, por ora, fluxo cambial ficou negativo em US$ 1,477 bilh„o","19/09/2018 ‡s 13h11","cambial, fluxo, negativo"
"6","Conselho do FGTS aprova regulamentaÁ„o de crÈdito para Santas Casas","www.valor.com.br/brasil/5861211/conselho-do-fgts-aprova-regulamentacao-de-credito-para-santas-casas","ResoluÁ„o n∫ 901 foi publicada nesta quarta-feira no ""Di·rio Oficial da Uni„o"" (DOU)","19/09/2018 ‡s 13h05","aprova, casa, conselho, credito, fgts, regulamentacao, santa, diario, dou, nesta, ofici, publicada, quartafeira, resolucao, uniao, macroeconomia"
"7","Ibovespa sobe e se firma em 78 mil pontos, de olho em eleiÁ„o e ajuste","www.valor.com.br/financas/5861173/ibovespa-sobe-e-se-firma-em-78-mil-pontos-de-olho-em-eleicao-e-ajuste","No mercado de c‚mbio, dÛlar recua para R$ 4,11","19/09/2018 ‡s 12h57","mercado"
"8","Comunicado do Copom pode trazer projeÁıes de inflaÁ„o mais altas","www.valor.com.br/financas/5861149/comunicado-do-copom-pode-trazer-projecoes-de-inflacao-mais-altas","Juro, contudo, deve ser mantido em 6,5% ao ano","19/09/2018 ‡s 12h48","alta, comunicado, copom, inflacao, pode, projeco, trazer, ano, contudo, deve, juro, mantido, ser, mercado"
"9","Suposto vazamento de pesquisa Ibope enfraquece reaÁ„o do mercado","www.valor.com.br/financas/5861021/suposto-vazamento-de-pesquisa-ibope-enfraquece-reacao-do-mercado","N˙meros da pesquisa teriam circulado nas mesas de operaÁ„o, conforme fontes","19/09/2018 ‡s 12h11","mercado, pesquisa"
"10","FT: Padrıes globais contra lavagem de dinheiro com criptomoedas est„o","www.valor.com.br/financas/5860891/ft-padroes-globais-contra-lavagem-de-dinheiro-com-criptomoedas-estao",NA,"19/09/2018 ‡s 11h43","contra, criptomoeda, dinheiro, estao, globai, lavagem, padro, investimento"
"11","Fundo pode investir indiretamente em criptoativo no exterior, diz CVM","www.valor.com.br/financas/5860875/fundo-pode-investir-indiretamente-em-criptoativo-no-exterior-diz-cvm","Em ofÌcio publicado nesta quarta-feira, regulador alerta, contudo, para cuidados com operaÁıes ilegais como lavagem de dinheiro e fraudes","19/09/2018 ‡s 11h41","fundo"
"12","Draghi: Zona do euro precisa de resposta em comum para crises futuras","www.valor.com.br/financas/5860869/draghi-zona-do-euro-precisa-de-resposta-em-comum-para-crises-futuras","ìPrecisamos de um instrumento fiscal adicional para prover estabilizaÁ„o"", afirmou o presidente do BCE","19/09/2018 ‡s 11h39","comum, crise, draghi, euro, futura, precisa, resposta, zona, adicion, afirmou, bce, estabilizacao, fiscal, instrumento, president, prover, ‚Äúprecisamo, monetaria, politica"
"13","Ibovespa opera em queda com investidor atento ‡ cena eleitoral","www.valor.com.br/financas/5860849/ibovespa-opera-em-queda-com-investidor-atento-cena-eleitoral","AÁıes da Eletrobras tinham baixa expressiva. Investidores consideram ˙ltima pesquisa eleitoral, divulgada pelo Ibope","19/09/2018 ‡s 11h36","eleitor, investidor"
"14","DÛlar e juros invertem movimento da abertura e operam em baixa","www.valor.com.br/financas/5860401/dolar-e-juros-invertem-movimento-da-abertura-e-operam-em-baixa","AlÈm de cena eleitoral, investidores ficam atentos nesta jornada na decis„o do Copom","19/09/2018 ‡s 10h06","abertura, baixa, dolar, invertem, juro, movimento, operam, atento, cena, copom, decisao, eleitor, ficam, investidor, jornada, nesta, mercado"
"15","Bolsas da ¡sia avanÁam em meio ‡ expectativa de medidas na China","www.valor.com.br/financas/5859821/bolsas-da-asia-avancam-em-meio-expectativa-de-medidas-na-china","Investidores continuam atentos ao cen·rio geopolÌtico","19/09/2018 ‡s 08h19","asia, avancam, bolsa, china, expectativa, medida, meio, atento, cenario, continuam, geopolitico, investidor, mercado"
"16","DÛlar fecha em alta de 0,38% em dia de ajustes","www.valor.com.br/financas/5858211/dolar-fecha-em-alta-de-038-em-dia-de-ajustes","Volatilidade de cinco dias terminou sess„o em 13,25%, menor nÌvel desde 23 de agosto (12,02%), voltando a operar abaixo da mÈdia do ano","18/09/2018 ‡s 18h00","dia"
"17","Juros futuros tÍm segundo dia de alÌvio com cen·rio polÌtico","www.valor.com.br/financas/5858177/juros-futuros-tem-segundo-dia-de-alivio-com-cenario-politico","De acordo com profissionais de mercado, os investidores comeÁam a ver chance de Bolsonaro vencer no segundo turno e ajustam suas apostas","18/09/2018 ‡s 17h50","segundo, mercado"
"18","PetrÛleo fecha em alta de mais de 1%, com risco sobre oferta","www.valor.com.br/financas/5858099/petroleo-fecha-em-alta-de-mais-de-1-com-risco-sobre-oferta","Contratos do Brent para novembro fecharam a terÁa em alta de 1,25%, a US$ 79,03 por barril; WTI para o mesmo mÍs avanÁaram 1,32%","18/09/2018 ‡s 17h30","alta"
"19","Sapore tentar voltar ‡ mesa de negociaÁıes com IMC","www.valor.com.br/empresas/5857869/sapore-tentar-voltar-mesa-de-negociacoes-com-imc","Controlador da Sapore, Daniel Mendez, n„o desistiu do negÛcio, mas nega que j· existam discussıes com o fundo Kinea nesse sentido","18/09/2018 ‡s 16h32","sapor"
"20","Ibovespa sobe com cen·rio externo positivo","www.valor.com.br/financas/5857303/ibovespa-sobe-com-cenario-externo-positivo","Mercados globais n„o deram sinais de turbulÍncia ante as novas taxas de importaÁ„o para produtos chineses anunciada pelos EUA","18/09/2018 ‡s 13h41","mercado"
"21","Bolsas da Europa fecham na maioria em alta, com tensıes EUA-China","www.valor.com.br/financas/5857293/bolsas-da-europa-fecham-na-maioria-em-alta-com-tensoes-eua-china","Apesar da nova sobretaxa sobre US$ 200 bi de produtos chineses, o governo dos EUA adotou alÌquota de 10% e n„o de 25%, proporcionando alÌvio","18/09/2018 ‡s 13h39","alta, bolsa, euachina, europa, fecham, maioria, tenso, adotou, aliquota, alivio, apesar, chines, eua, governo, nova, produto, proporcionando, sobr, sobretaxa, mercado"
"22","Cielo lanÁa maquininha de cart„o integrada a smartphone","www.valor.com.br/financas/5857245/cielo-lanca-maquininha-de-cartao-integrada-smartphone","Batizado de Lio+, o terminal funcionar· com chips de todas as operadoras de celular","18/09/2018 ‡s 13h32","cartao, cielo, integrada, lanca, maquininha, smartphon, batizado, celular, chip, funcionara, lio, operadora, termin, toda, carto"
"23","Para BB, uso de banco para fomentar crÈdito tem de respeitar regras","www.valor.com.br/financas/5857193/para-bb-uso-de-banco-para-fomentar-credito-tem-de-respeitar-regras","Segundo executivo da instituiÁ„o, qualquer implementaÁ„o depende de uma decis„o do prÛprio banco e do BC, alÈm de respeitar a governanÁa","18/09/2018 ‡s 13h09","banco, respeitar"
"24","Fonte diz que Facebook procura bancos para acessar clientes; cia nega","www.valor.com.br/empresas/5857085/fonte-diz-que-facebook-procura-bancos-para-acessar-clientes-cia-nega","Pelo menos uma grande instituiÁ„o americana j· rejeitou as negociaÁıes, segundo fontes","18/09/2018 ‡s 12h40","font"
"25","Ibovespa sobe com exterior positivo e com ajuda de Vale e Petrobras","www.valor.com.br/financas/5857027/ibovespa-sobe-com-exterior-positivo-e-com-ajuda-de-vale-e-petrobras","AlÈm do bom desempenho dos mercados acion·rios globais, investidores consideram a valorizaÁ„o das commodities","18/09/2018 ‡s 12h22","mercado"
"26","China est· redirecionando investimentos dos EUA para a Europa","www.valor.com.br/internacional/5856957/china-esta-redirecionando-investimentos-dos-eua-para-europa","Outras disputas econÙmicas est„o ocorrendo de maneira menos aparente e empurrando a China a investir na Europa, dizem analistas","18/09/2018 ‡s 12h06","china, europa"
"27","N˙mero de inadimplentes recua em agosto, aponta Serasa","www.valor.com.br/brasil/5856821/numero-de-inadimplentes-recua-em-agosto-aponta-serasa","O montante de dÌvidas em agosto atingiu R$ 274 bilhıes, com mÈdia de quatro dÌvidas por CPF, totalizando R$ 4.453 por pessoa","18/09/2018 ‡s 11h37","agosto, divida"
"28","Cielo lanÁa sistema de pagamentos por QR Code para smartphones","www.valor.com.br/financas/5856783/cielo-lanca-sistema-de-pagamentos-por-qr-code-para-smartphones","Cerca de 40 milhıes de clientes de instituiÁıes parceiras j· est„o aptos a usar a soluÁ„o","18/09/2018 ‡s 11h28","cielo, code, lanca, pagamento, sistema, smartphon, apto, cerca, client, estao, instituico, milho, parceira, solucao, usar, carto"
"29","BNDES lanÁa edital para fundo de R$ 500 milhıes em infraestrutura","www.valor.com.br/financas/5856781/bndes-lanca-edital-para-fundo-de-r-500-milhoes-em-infraestrutura","Banco espera aumentar a base de investidores e incrementar a liquidez de tÌtulos do setor, bem como securitizar parte de sua carteira","18/09/2018 ‡s 11h28","bndes, edit, fundo, infraestrutura, lanca, milho, aumentar, banco, base, bem, carteira, espera, incrementar, investidor, liquidez, part, securitizar, setor, titulo, financa"
"30","DÛlar opera perto da estabilidade e È cotado na casa de R$ 4,13","www.valor.com.br/financas/5856471/dolar-opera-perto-da-estabilidade-e-e-cotado-na-casa-de-r-413","Acirramento da disputa comercial entre China e EUA e corrida eleitoral brasileira dividem atenÁıes dos investidores","18/09/2018 ‡s 10h28","casa, cotado, dolar, estabilidad, opera, perto, acirramento, atenco, brasileira, china, comerci, corrida, disputa, dividem, eleitor, eua, investidor, mercado"
"31","Fonte diz que Facebook procura bancos para acessar clientes; cia nega","www.valor.com.br/empresas/5857085/fonte-diz-que-facebook-procura-bancos-para-acessar-clientes-cia-nega","Pelo menos uma grande instituiÁ„o americana j· rejeitou as negociaÁıes, segundo fontes","18/09/2018 ‡s 12h40","font"
"32","Ibovespa sobe com exterior positivo e com ajuda de Vale e Petrobras","www.valor.com.br/financas/5857027/ibovespa-sobe-com-exterior-positivo-e-com-ajuda-de-vale-e-petrobras","AlÈm do bom desempenho dos mercados acion·rios globais, investidores consideram a valorizaÁ„o das commodities","18/09/2018 ‡s 12h22","mercado"
"33","China est· redirecionando investimentos dos EUA para a Europa","www.valor.com.br/internacional/5856957/china-esta-redirecionando-investimentos-dos-eua-para-europa","Outras disputas econÙmicas est„o ocorrendo de maneira menos aparente e empurrando a China a investir na Europa, dizem analistas","18/09/2018 ‡s 12h06","china, europa"
"34","N˙mero de inadimplentes recua em agosto, aponta Serasa","www.valor.com.br/brasil/5856821/numero-de-inadimplentes-recua-em-agosto-aponta-serasa","O montante de dÌvidas em agosto atingiu R$ 274 bilhıes, com mÈdia de quatro dÌvidas por CPF, totalizando R$ 4.453 por pessoa","18/09/2018 ‡s 11h37","agosto, divida"
"35","Cielo lanÁa sistema de pagamentos por QR Code para smartphones","www.valor.com.br/financas/5856783/cielo-lanca-sistema-de-pagamentos-por-qr-code-para-smartphones","Cerca de 40 milhıes de clientes de instituiÁıes parceiras j· est„o aptos a usar a soluÁ„o","18/09/2018 ‡s 11h28","cielo, code, lanca, pagamento, sistema, smartphon, apto, cerca, client, estao, instituico, milho, parceira, solucao, usar, carto"
"36","BNDES lanÁa edital para fundo de R$ 500 milhıes em infraestrutura","www.valor.com.br/financas/5856781/bndes-lanca-edital-para-fundo-de-r-500-milhoes-em-infraestrutura","Banco espera aumentar a base de investidores e incrementar a liquidez de tÌtulos do setor, bem como securitizar parte de sua carteira","18/09/2018 ‡s 11h28","bndes, edit, fundo, infraestrutura, lanca, milho, aumentar, banco, base, bem, carteira, espera, incrementar, investidor, liquidez, part, securitizar, setor, titulo, financa"
"37","DÛlar opera perto da estabilidade e È cotado na casa de R$ 4,13","www.valor.com.br/financas/5856471/dolar-opera-perto-da-estabilidade-e-e-cotado-na-casa-de-r-413","Acirramento da disputa comercial entre China e EUA e corrida eleitoral brasileira dividem atenÁıes dos investidores","18/09/2018 ‡s 10h28","casa, cotado, dolar, estabilidad, opera, perto, acirramento, atenco, brasileira, china, comerci, corrida, disputa, dividem, eleitor, eua, investidor, mercado"
"38","Bolsas da ¡sia ignoraram tarifas sobre China e fecham em alta","www.valor.com.br/financas/5855807/bolsas-da-asia-ignoraram-tarifas-sobre-china-e-fecham-em-alta","Raz„o est· na antecipaÁ„o dessa notÌcia h· semanas, seja por declaraÁıes dos dois governos, seja por an·lises e cobertura na imprensa","18/09/2018 ‡s 08h18","alta, asia, bolsa, china, fecham, ignoraram, sobr, tarifa, analis, antecipacao, cobertura, declaraco, dessa, doi, governo, imprensa, noticia, razao, semana, mercado"
"39","Bolsa prepara mudanÁas no mercado de acesso","www.valor.com.br/financas/5854869/bolsa-prepara-mudancas-no-mercado-de-acesso","ApÛs 13 anos do Bovespa Mais, discussıes visam reduÁ„o de exigÍncias para aumentar ades„o de empresas","18/09/2018 ‡s 05h00","mercado"
"40","Mercado trata Haddad com ceticismo","www.valor.com.br/financas/5854867/mercado-trata-haddad-com-ceticismo","Ibovespa sobe 1,80% e dÛlar cai 0,98%, mas alÌvio ainda deve ser colocado ‡ prova","18/09/2018 ‡s 05h00","mercado"
"41","AgÍncia adverte Credit por falha no combate ‡ lavagem de dinheiro","www.valor.com.br/financas/5854865/agencia-adverte-credit-por-falha-no-combate-lavagem-de-dinheiro","Regulador pede que instituiÁ„o suÌÁa reforce medida de proteÁ„o e cita casos de Fifa, Petrobras e PDVSA","18/09/2018 ‡s 05h00","advert, agencia, combat, credit, dinheiro, falha, lavagem, caso, cita, fifa, instituicao, medida, pdvsa, pede, petrobra, protecao, reforc, regulador, suica, financeira, instituico"
"42","DÛlar e aÁıes caem em NY com tens„o comercial","www.valor.com.br/financas/5854863/dolar-e-acoes-caem-em-ny-com-tensao-comercial","Baixa foi puxada pelo setor de tecnologia","18/09/2018 ‡s 05h00","aco, caem, comerci, dolar, tensao, baixa, puxada, setor, tecnologia, mercado"
"43","Que diferenÁa faz o resultado eleitoral para os investimentos?","www.valor.com.br/financas/5854859/que-diferenca-faz-o-resultado-eleitoral-para-os-investimentos","… importante olhar os fundamentos macro e microeconÙmicos, mas com cuidado adicional para necessidade de hedge e diversificaÁ„o","18/09/2018 ‡s 05h00","investimento"
"44","BCE deve seguir com orientaÁ„o futura mesmo apÛs fim do 'QE'","www.valor.com.br/financas/5854857/bce-deve-seguir-com-orientacao-futura-mesmo-apos-fim-do-qe","A sinalizaÁ„o de que os juros permaneceriam nas mÌnimas histÛricas por um longo tempo fez com que as taxas de mercado ficassem contidas","18/09/2018 ‡s 05h00","mercado"
"45","Deutsche Bank pode transferir ativos de Londres apÛs Brexit","www.valor.com.br/financas/5854855/deutsche-bank-pode-transferir-ativos-de-londres-apos-brexit","Banco j· designou mais de um quarto de seus ativos no Reino Unido para transferÍncia","18/09/2018 ‡s 05h00","ativo"
"46","Governo reduz novamente orÁamento para o seguro rural","www.valor.com.br/agro/5854323/governo-reduz-novamente-orcamento-para-o-seguro-rural","Na proposta de OrÁamento que enviou ao Congresso, Planalto previu R$ 450 milhıes, menos que os R$ 600 milhıes prometidos por Blairo Maggi","17/09/2018 ‡s 18h31","orcamento, milho"
"47","Ibovespa sobe, mas risco polÌtico mantÈm cautela dos investidores","www.valor.com.br/financas/5854307/ibovespa-sobe-mas-risco-politico-mantem-cautela-dos-investidores","Com a ascens„o de Fernando Haddad nas pesquisas de intenÁ„o de voto as preocupaÁıes continuam rondando os negÛcios","17/09/2018 ‡s 18h27","cautela, ibovespa, investidor, mantem, politico, risco, sobe, ascensao, continuam, fernando, haddad, intencao, negocio, pesquisa, preocupaco, rondando, voto, mercado"
"48","DÛlar tem maior queda desde atentado contra Bolsonaro","www.valor.com.br/financas/5854295/dolar-tem-maior-queda-desde-atentado-contra-bolsonaro","Na mÌnima, o dÛlar comercial caiu a R$ 4,1181, depois de subir atÈ R$ 4,2036 no pior momento de nervosismo do dia","17/09/2018 ‡s 18h22","dolar"
"49","NY: Bolsas fecham em baixa, com tecnologia e tens„o EUA-China","www.valor.com.br/financas/5854255/ny-bolsas-fecham-em-baixa-com-tecnologia-e-tensao-eua-china","Entre as maiores perdas do dia est„o as aÁıes da Apple, que caÌram 2,66%, da Amazon, que recuaram 3,16% e do Twitter, com perdas de 4,2%","17/09/2018 ‡s 18h13","perda"
"50","Investidores acompanham discursos do PT e PSL e juros futuros caem","www.valor.com.br/financas/5854123/investidores-acompanham-discursos-do-pt-e-psl-e-juros-futuros-caem","ApÛs primeiras reaÁıes negativas ‡s pesquisas eleitorais no inÌcio do preg„o, os contratos de juros futuros passaram a cair no fim da manh„","17/09/2018 ‡s 17h35","futuro, juro"
"51","PetrÛleo devolve alta e fecha em leve baixa, com tens„o EUA-China","www.valor.com.br/financas/5854003/petroleo-devolve-alta-e-fecha-em-leve-baixa-com-tensao-eua-china","Os contratos do Brent para novembro fecharam com perdas de 0,06%, a US$ 78,05 por barril; os do WTI para o mesmo mÍs cederam 0,14%","17/09/2018 ‡s 17h07","alta, baixa, devolv, euachina, fecha, leve, petroleo, tensao, barril, brent, cederam, contrato, fecharam, mes, novembro, perda, wti, mercado"
"52","Suzano anuncia emiss„o de US$ 1 bilh„o em bÙnus de dez anos","www.valor.com.br/financas/5853877/suzano-anuncia-emissao-de-us-1-bilhao-em-bonus-de-dez-anos","Companhia tem realizado uma sÈrie de operaÁıes no mercado para rolar o emprÈstimo-ponte","17/09/2018 ‡s 16h40","ano, anuncia, bilhao, bonus, dez, emissao, suzano, companhia, emprestimopont, mercado, operaco, realizado, rolar, seri, captaco"
"53","Volks anuncia joint venture de divis„o da caminhıes com Hino Motors","www.valor.com.br/empresas/5853681/volks-anuncia-joint-venture-de-divisao-da-caminhoes-com-hino-motors","O objetivo È que o acordo seja concluÌdo no segundo semestre de 2019; operaÁ„o ainda ser· avaliada por Ûrg„os antitruste","17/09/2018 ‡s 15h50","anuncia, caminho, divisao, hino, joint, motor, ventur, volk, acordo, ainda, antitrust, avaliada, concluido, objetivo, operacao, orgao, segundo, semestr, sera, automovei"
"54","Falhas do Credit contra corrupÁ„o envolvem Petrobras, Fifa e PDVSA","www.valor.com.br/financas/5853499/falhas-do-credit-contra-corrupcao-envolvem-petrobras-fifa-e-pdvsa","Regulador banc·rio da SuÌÁa determinou que o banco melhore seus procedimentos contra lavagem de dinheiro, mas n„o impÙs multas ‡ instituiÁ„o","17/09/2018 ‡s 15h16","contra"
"55","Sal·rios em Wall Street atingem o nÌvel mais alto desde 2008","www.valor.com.br/financas/5853369/salarios-em-wall-street-atingem-o-nivel-mais-alto-desde-2008","H· dez anos, o banco Lehman Brothers quebrou e arrastou a economia mundial para uma crise financeira","17/09/2018 ‡s 14h50","alto, atingem, desd, nivel, salario, street, wall, ano, arrastou, banco, brother, crise, dez, economia, financeira, lehman, mundial, quebrou, financa"
"56","Argentina prevÍ queda de 0,5% do PIB para 2019 em projeto de orÁamento","www.valor.com.br/internacional/5853157/argentina-preve-queda-de-05-do-pib-para-2019-em-projeto-de-orcamento","O projeto de orÁamento tambÈm trabalha com a expectativa de uma inflaÁ„o acumulada de 23% para o fim de 2019 e um dÛlar cotado a 41,10 pesos","17/09/2018 ‡s 14h01","orcamento, projeto"
"57","Ibovespa tem ligeira alta, enquanto dÛlar segue inst·vel","www.valor.com.br/financas/5853119/ibovespa-tem-ligeira-alta-enquanto-dolar-segue-instavel","Pesquisas eleitorais d„o o tom do mercado financeiro nesta segunda-feira","17/09/2018 ‡s 13h52","mercado"
"58","Bolsas da Europa fecham sem direÁ„o ˙nica, com varejistas","www.valor.com.br/financas/5853011/bolsas-da-europa-fecham-sem-direcao-unica-com-varejistas","O Ìndice pan-europeu Stoxx 600 conseguiu encerrar a sess„o com ganho de 0,12%, impulsionado pelo avanÁo da varejista de moda H&M","17/09/2018 ‡s 13h34","varejista"
"59","Richard Clarida assume vice-presidÍncia do BC americano","www.valor.com.br/financas/5852625/richard-clarida-assume-vice-presidencia-do-bc-americano","PosiÁ„o de vice-presidente do Fed estava vaga desde outubro de 2017, quando Stanley Fischer deixou o cargo","17/09/2018 ‡s 12h19","americano, assum, clarida, richard, vicepresidencia, cargo, deixou, desd, fed, fischer, outubro, posicao, stanley, vaga, vicepresident, monetaria, politica"
"60","Ibovespa opera em alta, mas pesquisas eleitorais trazem cautela","www.valor.com.br/financas/5852069/ibovespa-opera-em-alta-mas-pesquisas-eleitorais-trazem-cautela","Com tom de cautela, volatilidade deve permanecer alta","17/09/2018 ‡s 11h03","alta, cautela"
"61","Richard Clarida assume vice-presidÍncia do BC americano","www.valor.com.br/financas/5852625/richard-clarida-assume-vice-presidencia-do-bc-americano","PosiÁ„o de vice-presidente do Fed estava vaga desde outubro de 2017, quando Stanley Fischer deixou o cargo","17/09/2018 ‡s 12h19","americano, assum, clarida, richard, vicepresidencia, cargo, deixou, desd, fed, fischer, outubro, posicao, stanley, vaga, vicepresident, monetaria, politica"
"62","Ibovespa opera em alta, mas pesquisas eleitorais trazem cautela","www.valor.com.br/financas/5852069/ibovespa-opera-em-alta-mas-pesquisas-eleitorais-trazem-cautela","Com tom de cautela, volatilidade deve permanecer alta","17/09/2018 ‡s 11h03","alta, cautela"
"63","Depois de abrir em alta e bater R$ 4,20, dÛlar perde forÁa","www.valor.com.br/financas/5851565/depois-de-abrir-em-alta-e-bater-r-420-dolar-perde-forca","Investidores acompanham corrida eleitoral e ambiente externo, especialmente disputa comercial entre EUA e China","17/09/2018 ‡s 10h03","abrir, alta, bater, dolar, forca, perd, acompanham, ambient, china, comerci, corrida, disputa, eleitor, especialment, eua, externo, investidor, mercado"
"64","Focus: Economistas Top 5 preveem dÛlar a R$ 3,95 no fim de 2018","www.valor.com.br/brasil/5851257/focus-economistas-top-5-preveem-dolar-r-395-no-fim-de-2018","Mesmo grupo espera uma cotaÁ„o maior da moeda americana no ano seguinte, de R$ 3,57","17/09/2018 ‡s 09h37","dolar, economista, fim, focus, preveem, top, americana, ano, cotacao, espera, grupo, maior, moeda, seguint, macroeconomia"
"65","Mercado vÍ inflaÁ„o mais alta e crescimento econÙmico menor em 2018","www.valor.com.br/brasil/5851023/mercado-ve-inflacao-mais-alta-e-crescimento-economico-menor-em-2018","No caso da taxa b·sica de juro, analistas consultados pelo BC reforÁaram aposta em 6,50%","17/09/2018 ‡s 09h12","alta, crescimento, economico, inflacao, menor, mercado, analista, aposta, basica, caso, consultado, juro, reforcaram, taxa, macroeconomia"
"66","OperaÁ„o policial combate crimes cibernÈticos em seis Estados","www.valor.com.br/politica/5850763/operacao-policial-combate-crimes-ciberneticos-em-seis-estados","Mensagens enviadas como sendo de instituiÁıes banc·rias pediam que os clientes atualizassem suas senhas clicando em um endereÁo especÌfico","17/09/2018 ‡s 08h46","cibernetico, combat, crime, estado, operacao, polici, sei, atualizassem, bancaria, clicando, client, endereco, enviada, especifico, instituico, mensagen, pediam, sendo, senha, judiciario"
"67","Bolsas da ¡sia fecham em queda com tens„o comercial","www.valor.com.br/financas/5850247/bolsas-da-asia-fecham-em-queda-com-tensao-comercial","Jornada n„o contou com TÛquio, cuja praÁa acion·ria ficou fechada devido a feriado","17/09/2018 ‡s 07h56","asia, bolsa, comerci, fecham, queda, tensao, acionaria, contou, cuja, devido, fechada, feriado, ficou, jornada, praca, toquio, mercado"
"68","PrevidÍncia privada È opÁ„o para idoso planejar sucess„o?","www.valor.com.br/financas/consultorio-financeiro/5838343/previdencia-privada-e-opcao-para-idoso-planejar-sucessao","Plano permite a livre inclus„o de benefici·rios pelo titular","17/09/2018 ‡s 05h00","idoso, opcao, planejar, previdencia, privada, sucessao, beneficiario, inclusao, livr, permit, plano, titular, consultorio, financeiro"
